{
  "$schema": "https://json-schema.org/draft/2020-12/schema",
  "$id": "https://raw.githubusercontent.com/Kevinzzz6/zcode-canvas/main/schema/theme.schema.json",
  "title": "ZCode Canvas theme",
  "description": "theme.json, format 1. See docs/theme-format.md.",
  "type": "object",
  "required": ["name"],
  "additionalProperties": false,
  "properties": {
    "$schema": { "type": "string" },
    "format": { "const": 1, "description": "theme.json format version. Omitted means 1." },
    "name": { "type": "string", "minLength": 1 },
    "description": { "type": "string" },
    "author": { "type": "string" },
    "version": { "type": "string", "description": "Version of the theme itself." },
    "license": { "type": "string", "description": "SPDX license id, e.g. MIT." },
    "source": { "type": "string", "description": "Where the theme or the work it adapts comes from." },
    "modes": {
      "type": "array",
      "description": "Modes the theme is designed for. Omitted means both.",
      "items": { "$ref": "#/$defs/mode" },
      "minItems": 1,
      "uniqueItems": true
    },
    "colors": {
      "type": "object",
      "description": "ZCode color tokens per mode: \"sidebar\" or \"--color-sidebar\".",
      "additionalProperties": false,
      "properties": {
        "dark": { "$ref": "#/$defs/colorTokens" },
        "light": { "$ref": "#/$defs/colorTokens" }
      }
    },
    "accent": {
      "description": "Fills primary / brand / ring / primary-foreground wherever colors leaves them unset.",
      "oneOf": [
        { "$ref": "#/$defs/colorValue" },
        {
          "type": "object",
          "additionalProperties": false,
          "properties": { "dark": { "$ref": "#/$defs/colorValue" }, "light": { "$ref": "#/$defs/colorValue" } }
        }
      ]
    },
    "radius": {
      "type": "number",
      "minimum": 0,
      "maximum": 4,
      "description": "Corner radius scale: 1 = official, 0 = square. rounded-full shapes stay round."
    },
    "vars": {
      "type": ["object", "null"],
      "description": "Other CSS custom properties for both modes, optionally refined under dark / light. null clears them all; null under a mode clears that mode.",
      "properties": {
        "dark": { "oneOf": [{ "type": "null" }, { "$ref": "#/$defs/customProperties" }] },
        "light": { "oneOf": [{ "type": "null" }, { "$ref": "#/$defs/customProperties" }] }
      },
      "patternProperties": { "^--[\\w-]+$": { "$ref": "#/$defs/cssValue" } },
      "additionalProperties": false
    },
    "wallpaper": {
      "description": "Shared wallpaper settings, optionally refined under dark / light. null removes it.",
      "oneOf": [
        { "type": "null" },
        {
          "allOf": [{ "$ref": "#/$defs/wallpaperFields" }],
          "type": "object",
          "properties": {
            "dark": { "oneOf": [{ "type": "null" }, { "$ref": "#/$defs/wallpaper" }] },
            "light": { "oneOf": [{ "type": "null" }, { "$ref": "#/$defs/wallpaper" }] }
          },
          "unevaluatedProperties": false
        }
      ]
    },
    "glass": {
      "type": "object",
      "additionalProperties": false,
      "properties": {
        "material": { "enum": ["acrylic", "mica", "tabbed", "none"], "description": "Native window material." },
        "opacity": { "type": "number", "minimum": 0, "maximum": 1, "description": "1 = official opaque surfaces." },
        "blur": { "type": "number", "minimum": 0, "maximum": 100, "description": "Backdrop blur of content surfaces, px." }
      }
    },
    "startup": {
      "type": "object",
      "additionalProperties": false,
      "properties": {
        "background": { "oneOf": [{ "type": "null" }, { "$ref": "#/$defs/imageValue" }], "description": "Color or gradient." },
        "logo": { "oneOf": [{ "type": "null" }, { "type": "string" }], "description": "Image replacing the ZCode logo tile." },
        "logoSize": { "type": "number", "minimum": 16, "maximum": 512 },
        "animation": { "enum": ["pop", "fade", "none"] }
      }
    }
  },
  "$defs": {
    "mode": { "enum": ["dark", "light"] },
    "cssValue": {
      "type": "string",
      "description": "A vars value. Quotes are allowed (font stacks); function calls must be on the allowlist, lowercase.",
      "not": { "pattern": "[;{}<>@`\\\\]|[\\u0000-\\u001f\\u007f]|(?<![\\w-])(?!(?:calc|min|max|clamp|rgb|rgba|hsl|hsla|hwb|lab|lch|oklab|oklch|color|color-mix|light-dark|linear-gradient|radial-gradient|conic-gradient|repeating-linear-gradient|repeating-radial-gradient|repeating-conic-gradient|var)\\()[\\w-]*\\(" }
    },
    "colorValue": {
      "type": "string",
      "description": "A color: hex, named color, or color functions like rgb()/hsl()/oklch()/color-mix(), lowercase.",
      "not": { "pattern": "[;{}<>@`'\"\\\\]|[\\u0000-\\u001f\\u007f]|(?<![\\w-])(?!(?:calc|min|max|clamp|rgb|rgba|hsl|hsla|hwb|lab|lch|oklab|oklch|color|color-mix|light-dark)\\()[\\w-]*\\(" }
    },
    "imageValue": {
      "type": "string",
      "description": "A color or a gradient.",
      "not": { "pattern": "[;{}<>@`'\"\\\\]|[\\u0000-\\u001f\\u007f]|(?<![\\w-])(?!(?:calc|min|max|clamp|rgb|rgba|hsl|hsla|hwb|lab|lch|oklab|oklch|color|color-mix|light-dark|linear-gradient|radial-gradient|conic-gradient|repeating-linear-gradient|repeating-radial-gradient|repeating-conic-gradient)\\()[\\w-]*\\(" }
    },
    "positionValue": {
      "type": "string",
      "description": "A background-position: keywords, lengths, percentages, calc().",
      "not": { "pattern": "[;{}<>@`'\"\\\\]|[\\u0000-\\u001f\\u007f]|(?<![\\w-])(?!(?:calc|min|max|clamp)\\()[\\w-]*\\(" }
    },
    "colorTokens": {
      "type": "object",
      "propertyNames": { "pattern": "^(--color-)?[a-z0-9][a-z0-9-]*$" },
      "additionalProperties": { "$ref": "#/$defs/colorValue" }
    },
    "customProperties": {
      "type": "object",
      "propertyNames": { "pattern": "^--[\\w-]+$" },
      "additionalProperties": { "$ref": "#/$defs/cssValue" }
    },
    "wallpaperFields": {
      "type": "object",
      "properties": {
        "image": { "oneOf": [{ "type": "null" }, { "type": "string" }], "description": "png / jpg / webp / avif / gif / svg, relative to the theme folder." },
        "fit": { "enum": ["cover", "contain", "fill", "tile", "center"] },
        "position": { "$ref": "#/$defs/positionValue" },
        "blur": { "type": "number", "minimum": 0, "maximum": 200 },
        "dim": { "type": "number", "minimum": 0, "maximum": 1 },
        "overlay": { "oneOf": [{ "type": "null" }, { "$ref": "#/$defs/colorValue" }] },
        "scale": { "type": "number", "minimum": 0.1, "maximum": 4, "description": "Zoom around position, 1 = the fit as-is." },
        "saturate": { "type": "number", "minimum": 0, "maximum": 4, "description": "1 = unfiltered." },
        "brightness": { "type": "number", "minimum": 0, "maximum": 2, "description": "1 = unfiltered." },
        "contrast": { "type": "number", "minimum": 0, "maximum": 2, "description": "1 = unfiltered." },
        "grayscale": { "type": "number", "minimum": 0, "maximum": 1, "description": "0 = color, 1 = fully gray." }
      }
    },
    "wallpaper": {
      "type": "object",
      "allOf": [{ "$ref": "#/$defs/wallpaperFields" }],
      "unevaluatedProperties": false
    }
  }
}
