{
  "$schema": "https://raw.githubusercontent.com/Kevinzzz6/zcode-canvas/main/schema/theme.schema.json",
  "format": 1,
  "name": "护眼",
  "description": "偏暖低亮底色 + 高对比正文，减少大面积发光（配色改编自 zcode-eye-care，MIT）",
  "author": "ZCode Canvas",
  "version": "1.0.0",
  "license": "MIT",
  "source": "https://github.com/VoodooB0Ys/zcode-eye-care",
  "modes": [
    "dark",
    "light"
  ],
  "colors": {
    "light": {
      "background": "#f3eddf",
      "background-win-alt": "#ece5d2",
      "sidebar": "#ece5d2",
      "tab": "#ece5d2",
      "tab-active": "#fbf7ee",
      "panel": "#fbf7ee",
      "header": "#fbf7ee",
      "card": "#fbf7ee",
      "menu": "#fbf7ee",
      "menu-hover": "#ece5d2",
      "input": "#fbf7ee",
      "popover": "#fbf7ee",
      "toast": "#fbf7ee",
      "tooltip": "#ece5d2",
      "secondary": "#e4dcc9",
      "tag": "#e4dcc9",
      "foreground": "#2b2825",
      "foreground-subtle": "#2b2825b8",
      "foreground-subtlest": "#2b282566",
      "foreground-inverse": "#fbf7ee",
      "brand": "#2b2825",
      "primary": "#2b2825",
      "primary-foreground": "#fbf7ee",
      "border": "#2b28251f",
      "border-hover": "#2b282526",
      "hover": "#2b28250d",
      "selected": "#2b282514",
      "surface": "#2b28250a",
      "surface-hover": "#2b28250f",
      "accent": "#f0e7d2",
      "find-highlight": "#fbefc9",
      "find-highlight-active": "#d99a4e",
      "terminal-cursor": "#2b2825"
    },
    "dark": {
      "background": "#1c1a17",
      "background-win-alt": "#242119",
      "sidebar": "#1c1a17",
      "panel": "#211f1b",
      "header": "#211f1b",
      "tab": "#211f1b",
      "tab-active": "#1c1a17",
      "card": "#2a2721",
      "input": "#2a2721",
      "popover": "#2a2721",
      "menu": "#2a2721",
      "menu-hover": "#343028",
      "secondary": "#343028",
      "foreground": "#d9d2c3",
      "foreground-subtle": "#d9d2c3a8",
      "foreground-subtlest": "#d9d2c35c",
      "brand": "#e8dfcc",
      "primary": "#e8dfcc",
      "primary-foreground": "#1c1a17",
      "border": "#d9d2c31a",
      "border-hover": "#d9d2c326",
      "terminal-cursor": "#d9d2c3"
    }
  }
}
