{
  "name": "终末地 · 武陵青",
  "author": "ymh0000123 (dsh-theme-endfield), adapted for ZCode Canvas",
  "description": "终末地官网风格：奶油纸底、武陵青强调、等高线地形壁纸、全直角（适合亮色模式；改编自 dsh-theme-endfield，MIT）",
  "wallpaper": {
    "image": "wallpaper.svg",
    "fit": "cover",
    "dim": 0
  },
  "glass": {
    "opacity": 0.4,
    "blur": 0
  },
  "colors": {
    "dark": {
      "background-win-alt": "#101110",
      "background-alt": "#101110",
      "sidebar": "#101110",
      "background": "#101110",
      "panel": "#101110",
      "header": "#101110",
      "tab": "#101110",
      "tab-active": "#181a18",
      "card": "#181a18",
      "card-selected": "#1e201d",
      "input": "#181a18",
      "input-focused": "#181a18",
      "secondary": "#1e201d",
      "tag": "#1e201d",
      "tooltip": "#1e201d",
      "tooltip-tag": "#262825",
      "popover": "#1c1e1c",
      "popover-header": "#181a18",
      "menu": "#1c1e1c",
      "menu-hover": "#262825",
      "toast": "#1c1e1c",
      "border": "#343633",
      "border-hover": "#4a4d49",
      "hover": "rgba(245, 245, 240, 0.05)",
      "surface": "rgba(245, 245, 240, 0.04)",
      "surface-hover": "rgba(245, 245, 240, 0.08)",
      "foreground": "#f5f5f0",
      "foreground-subtle": "#898d89",
      "foreground-subtlest": "#5f625e",
      "foreground-inverse": "#101110",
      "accent": "#1e201d",
      "terminal-bg": "#101110",
      "terminal-fg": "#f5f5f0",
      "destructive": "#ff6b61",
      "success": "#4fbf5c",
      "warning": "#ffb700",
      "primary": "#14d0d0",
      "primary-foreground": "#101110",
      "brand": "#14d0d0",
      "ring": "#14d0d0",
      "input-border-focused": "#14d0d0",
      "selected": "rgba(20, 208, 208, 0.14)",
      "terminal-cursor": "#14d0d0",
      "terminal-cursor-accent": "#101110",
      "terminal-selection": "rgba(20, 208, 208, 0.28)",
      "find-highlight": "rgba(20, 208, 208, 0.25)",
      "find-highlight-active": "#14d0d0",
      "interaction-ask-surface": "rgba(20, 208, 208, 0.1)",
      "interaction-ask-foreground": "#14d0d0",
      "file-node": "rgba(20, 208, 208, 0.16)",
      "file-node-hover": "rgba(20, 208, 208, 0.24)",
      "file-node-foreground": "#14d0d0",
      "--radius": "0",
      "--radius-xs": "0",
      "--radius-sm": "0",
      "--radius-md": "0",
      "--radius-lg": "0",
      "--radius-xl": "0",
      "--radius-2xl": "0",
      "--radius-3xl": "0",
      "--workspace-panel-radius": "0",
      "--sidebar-border-radius": "0",
      "--tab-panel-border-radius": "0"
    },
    "light": {
      "background-win-alt": "#e8e8e2",
      "background-alt": "#e8e8e2",
      "sidebar": "#e8e8e2",
      "background": "#e8e8e2",
      "panel": "#e8e8e2",
      "header": "#e8e8e2",
      "tab": "#e8e8e2",
      "tab-active": "#f2f2ec",
      "card": "#f2f2ec",
      "card-selected": "#dcddd6",
      "input": "#f2f2ec",
      "input-focused": "#f2f2ec",
      "secondary": "#dcddd6",
      "tag": "#dcddd6",
      "tooltip": "#101110",
      "tooltip-foreground": "#f5f5f0",
      "popover": "#f2f2ec",
      "popover-header": "#e8e8e2",
      "menu": "#f2f2ec",
      "menu-hover": "#dcddd6",
      "toast": "#f2f2ec",
      "border": "#d8d9d5",
      "border-hover": "#b6b8b3",
      "hover": "rgba(16, 17, 16, 0.05)",
      "surface": "rgba(16, 17, 16, 0.04)",
      "surface-hover": "rgba(16, 17, 16, 0.08)",
      "foreground": "#101110",
      "foreground-subtle": "#4a4c48",
      "foreground-subtlest": "#8a8c86",
      "foreground-inverse": "#f5f5f0",
      "accent": "#dcddd6",
      "terminal-bg": "#f2f2ec",
      "terminal-fg": "#101110",
      "destructive": "#ff3b30",
      "success": "#2f9e44",
      "warning": "#d9822b",
      "primary": "#101110",
      "primary-foreground": "#f2f2ec",
      "brand": "#006a6a",
      "ring": "#006a6a",
      "input-border-focused": "#006a6a",
      "selected": "rgba(20, 208, 208, 0.22)",
      "terminal-cursor": "#006a6a",
      "terminal-cursor-accent": "#f2f2ec",
      "terminal-selection": "rgba(20, 208, 208, 0.4)",
      "find-highlight": "rgba(20, 208, 208, 0.45)",
      "find-highlight-active": "#14d0d0",
      "interaction-ask-surface": "rgba(0, 106, 106, 0.08)",
      "interaction-ask-foreground": "#006a6a",
      "file-node": "rgba(0, 106, 106, 0.16)",
      "file-node-hover": "rgba(0, 106, 106, 0.24)",
      "file-node-foreground": "#006a6a",
      "--radius": "0",
      "--radius-xs": "0",
      "--radius-sm": "0",
      "--radius-md": "0",
      "--radius-lg": "0",
      "--radius-xl": "0",
      "--radius-2xl": "0",
      "--radius-3xl": "0",
      "--workspace-panel-radius": "0",
      "--sidebar-border-radius": "0",
      "--tab-panel-border-radius": "0"
    }
  },
  "startup": {
    "background": "linear-gradient(90deg, #14d0d0 0 10px, #101110 10px)",
    "logo": "logo.svg",
    "logoSize": 360,
    "animation": "fade"
  }
}
